Domain,Question,,,,,,,,,,,,Answer
Artificial Intelligence,What is Artificial Intelligence?,Artificial Intelligence (AI) refers to the simulation of human intelligence in machines that are programmed to think, reason, and learn from experience.,,,,,,,,,Artificial Intelligence (AI) refers to the simulation of human intelligence in machines that are programmed to think  reason  and learn from experience.
Artificial Intelligence,"What is the difference between AI , Machine Learning  and Deep Learning? ",, ,AI is the broader concept, while machine learning is a subset of AI focused on algorithms that allow systems to learn from data. Deep learning is a subset of machine learning that uses neural networks to model complex patterns.,,,,,,,,AI is the broader concept  while machine learning is a subset of AI focused on algorithms that allow systems to learn from data. Deep learning is a subset of machine learning that uses neural networks to model complex patterns.
Artificial Intelligence,What are the types of AI?,AI is typically categorized into three types: Artificial Narrow Intelligence (ANI), Artificial General Intelligence (AGI), and Artificial Superintelligence (ASI).,,,,,,,,,AI is typically categorized into three types: Artificial Narrow Intelligence (ANI)  Artificial General Intelligence (AGI)  and Artificial Superintelligence (ASI).
Artificial Intelligence,What is supervised learning?,Supervised learning is a machine learning technique where a model is trained on labeled data, and the goal is to learn a mapping from inputs to the correct output.,,,,,,,,,,Supervised learning is a machine learning technique where a model is trained on labeled data  and the goal is to learn a mapping from inputs to the correct output.
Artificial Intelligence,What is unsupervised learning?,Unsupervised learning involves training a model on data without labeled outputs, and the goal is to find hidden patterns or groupings in the data.,,,,,,,,,,Unsupervised learning involves training a model on data without labeled outputs  and the goal is to find hidden patterns or groupings in the data.
Artificial Intelligence,What is reinforcement learning?,Reinforcement learning is a type of machine learning where an agent learns to make decisions by performing actions in an environment and receiving feedback in the form of rewards or penalties.,,,,,,,,,,,Reinforcement learning is a type of machine learning where an agent learns to make decisions by performing actions in an environment and receiving feedback in the form of rewards or penalties.
Artificial Intelligence,What is natural language processing (NLP)?,Natural Language Processing is a field of AI that focuses on the interaction between computers and human languages, enabling machines to understand, interpret, and respond to human language.,,,,,,,,Natural Language Processing is a field of AI that focuses on the interaction between computers and human languages  enabling machines to understand  interpret  and respond to human language.
Artificial Intelligence,What is a neural network?,A neural network is a set of algorithms modeled after the human brain, designed to recognize patterns in data by processing inputs through interconnected layers of nodes.,,,,,,,,,,A neural network is a set of algorithms modeled after the human brain  designed to recognize patterns in data by processing inputs through interconnected layers of nodes.
Artificial Intelligence,What is the Turing test?,The Turing test is a measure of a machine's ability to exhibit intelligent behavior that is indistinguishable from that of a human, proposed by Alan Turing.,,,,,,,,,,The Turing test is a measure of a machine's ability to exhibit intelligent behavior that is indistinguishable from that of a human  proposed by Alan Turing.
Artificial Intelligence,What are expert systems?,Expert systems are AI programs designed to mimic the decision-making abilities of a human expert in a specific domain, using a knowledge base and inference rules.,,,,,,,,,,Expert systems are AI programs designed to mimic the decision-making abilities of a human expert in a specific domain  using a knowledge base and inference rules.
Artificial Intelligence,What is an AI agent?,An AI agent is an entity that perceives its environment through sensors and acts upon it through actuators, with the goal of achieving certain objectives.,,,,,,,,,,An AI agent is an entity that perceives its environment through sensors and acts upon it through actuators  with the goal of achieving certain objectives.
Artificial Intelligence,What is the difference between AI and automation?,AI refers to machines or systems that can mimic human intelligence, while automation involves using technology to perform repetitive tasks without human intervention.,,,,,,,,,,AI refers to machines or systems that can mimic human intelligence  while automation involves using technology to perform repetitive tasks without human intervention.
Artificial Intelligence,What is computer vision?,Computer vision is a field of AI that enables computers to interpret and make decisions based on visual data from the world, such as images and video.,,,,,,,,,,Computer vision is a field of AI that enables computers to interpret and make decisions based on visual data from the world  such as images and video.
Artificial Intelligence,What is the role of an algorithm in AI?,An algorithm in AI defines the steps needed to solve a problem, from data processing to decision-making, helping the system make intelligent predictions or decisions.,,,,,,,,,An algorithm in AI defines the steps needed to solve a problem  from data processing to decision-making  helping the system make intelligent predictions or decisions.
Artificial Intelligence,What is decision tree learning?,Decision tree learning is a supervised machine learning algorithm used to create a model that makes decisions based on a tree-like structure of rules or conditions.,,,,,,,,,,,Decision tree learning is a supervised machine learning algorithm used to create a model that makes decisions based on a tree-like structure of rules or conditions.
Artificial Intelligence,What is the purpose of deep learning?,Deep learning aims to model high-level abstractions in data by using multi-layered neural networks, enabling systems to learn complex patterns such as images, speech, and text.,,,,,,,,Deep learning aims to model high-level abstractions in data by using multi-layered neural networks  enabling systems to learn complex patterns such as images  speech  and text.
Artificial Intelligence,What is the difference between symbolic AI and connectionist AI?,Symbolic AI uses symbols and rules to represent knowledge and reasoning, while connectionist AI (like neural networks) models the brain's structure to learn from data.,,,,,,,,,,Symbolic AI uses symbols and rules to represent knowledge and reasoning  while connectionist AI (like neural networks) models the brain's structure to learn from data.
Artificial Intelligence,What is an artificial neural network?,An artificial neural network is a computational model inspired by the brain's neural networks, consisting of layers of nodes (neurons) connected by weighted edges that learn patterns from data.,,,,,,,,,,An artificial neural network is a computational model inspired by the brain's neural networks  consisting of layers of nodes (neurons) connected by weighted edges that learn patterns from data.
Artificial Intelligence,What is a convolutional neural network (CNN)?,A convolutional neural network is a specialized type of deep learning model used primarily for image recognition tasks, using convolutional layers to extract features from images.,,,,,,,,,,A convolutional neural network is a specialized type of deep learning model used primarily for image recognition tasks  using convolutional layers to extract features from images.
Artificial Intelligence,What is a recurrent neural network (RNN)?,A recurrent neural network is a type of neural network designed for sequence prediction, where the output from previous steps is used as input for the next step in the sequence.,,,,,,,,,,A recurrent neural network is a type of neural network designed for sequence prediction  where the output from previous steps is used as input for the next step in the sequence.
Artificial Intelligence,What is backpropagation?,Backpropagation is a supervised learning algorithm used in neural networks to minimize the error by updating the weights through gradient descent based on the output error.,,,,,,,,,,,Backpropagation is a supervised learning algorithm used in neural networks to minimize the error by updating the weights through gradient descent based on the output error.
Artificial Intelligence,What is a generative adversarial network (GAN)?,A generative adversarial network consists of two neural networks (a generator and a discriminator) that compete to create and identify realistic synthetic data.,,,,,,,,,,,A generative adversarial network consists of two neural networks (a generator and a discriminator) that compete to create and identify realistic synthetic data.
Artificial Intelligence,What is the difference between shallow learning and deep learning?,Shallow learning refers to simpler machine learning algorithms with fewer layers or no layers, while deep learning refers to complex models with many layers, such as deep neural networks.,,,,,,,,,Shallow learning refers to simpler machine learning algorithms with fewer layers or no layers  while deep learning refers to complex models with many layers  such as deep neural networks.
Artificial Intelligence,What is transfer learning?,Transfer learning is a technique where a model trained on one task is reused or fine-tuned for a different but related task, saving time and resources.,,,,,,,,,,Transfer learning is a technique where a model trained on one task is reused or fine-tuned for a different but related task  saving time and resources.
Artificial Intelligence,What are the main components of an AI system?,The main components of an AI system include sensors (to perceive the environment), actuators (to take actions), a knowledge base (to store information), and algorithms (to process the data and make decisions).,,,,,,,,The main components of an AI system include sensors (to perceive the environment)  actuators (to take actions)  a knowledge base (to store information)  and algorithms (to process the data and make decisions).
Artificial Intelligence,What is reinforcement learning?,Reinforcement learning is a type of machine learning where an agent learns to make decisions by interacting with an environment and receiving rewards or penalties.,,,,,,,,,,,Reinforcement learning is a type of machine learning where an agent learns to make decisions by interacting with an environment and receiving rewards or penalties.
Artificial Intelligence,What are chatbots?,Chatbots are AI systems that simulate conversation with users through text or voice, often used for customer service or virtual assistants.,,,,,,,,,,Chatbots are AI systems that simulate conversation with users through text or voice  often used for customer service or virtual assistants.
Artificial Intelligence,What is the difference between AI and ML?,AI is the broader concept of machines performing tasks that typically require human intelligence, while ML is a subset of AI that focuses on algorithms that allow systems to learn from data.,,,,,,,,,,AI is the broader concept of machines performing tasks that typically require human intelligence  while ML is a subset of AI that focuses on algorithms that allow systems to learn from data.
Artificial Intelligence,What are the types of reinforcement learning?,The types of reinforcement learning include model-based RL, model-free RL, and deep reinforcement learning.,,,,,,,,,The types of reinforcement learning include model-based RL  model-free RL  and deep reinforcement learning.
Artificial Intelligence,What is fuzzy logic?,Fuzzy logic is a form of logic used in AI that deals with reasoning that is approximate rather than precise, allowing for more flexible decision-making in uncertain environments.,,,,,,,,,,Fuzzy logic is a form of logic used in AI that deals with reasoning that is approximate rather than precise  allowing for more flexible decision-making in uncertain environments.
Artificial Intelligence,What is the purpose of clustering in AI?,Clustering is an unsupervised learning technique used to group similar data points together, allowing the system to identify patterns or structures in the data.,,,,,,,,,,Clustering is an unsupervised learning technique used to group similar data points together  allowing the system to identify patterns or structures in the data.
Artificial Intelligence,What are the challenges in AI?,The challenges in AI include ethical concerns, lack of interpretability, data privacy issues, bias in training data, and limited generalization across different domains.,,,,,,,The challenges in AI include ethical concerns  lack of interpretability  data privacy issues  bias in training data  and limited generalization across different domains.
Artificial Intelligence,What is explainable AI (XAI)?,Explainable AI refers to AI systems that are designed to be transparent and understandable, allowing humans to interpret the reasoning behind the model's decisions.,,,,,,,,,,Explainable AI refers to AI systems that are designed to be transparent and understandable  allowing humans to interpret the reasoning behind the model's decisions.
Artificial Intelligence,What is a chatbot architecture?,A chatbot architecture refers to the structure of a chatbot system, including the user interface, natural language processing components, and the backend AI models that drive the bot's responses.,,,,,,,,A chatbot architecture refers to the structure of a chatbot system  including the user interface  natural language processing components  and the backend AI models that drive the bot's responses.
Artificial Intelligence,What are decision support systems (DSS)?,Decision support systems are AI-based tools designed to assist decision-makers by analyzing data and providing insights to make informed choices.,,,,,,,,,,,Decision support systems are AI-based tools designed to assist decision-makers by analyzing data and providing insights to make informed choices.
Artificial Intelligence,What is the difference between AI and deep learning?,AI encompasses all techniques that enable machines to perform intelligent tasks, while deep learning is a specific subset that uses neural networks to model complex patterns in large datasets.,,,,,,,,,,AI encompasses all techniques that enable machines to perform intelligent tasks  while deep learning is a specific subset that uses neural networks to model complex patterns in large datasets.
Artificial Intelligence,What is a knowledge-based system?,A knowledge-based system is an AI system that uses a large set of rules and facts to simulate human decision-making in a specific domain.,,,,,,,,,,,A knowledge-based system is an AI system that uses a large set of rules and facts to simulate human decision-making in a specific domain.
Artificial Intelligence,What is semantic analysis?,Semantic analysis is a field of natural language processing that focuses on understanding the meaning of words and sentences in human language, rather than just their structure.,,,,,,,,,,Semantic analysis is a field of natural language processing that focuses on understanding the meaning of words and sentences in human language  rather than just their structure.
Artificial Intelligence,What is a Markov decision process?,A Markov decision process is a mathematical model used to represent decision-making situations where outcomes are partially random and partially under the control of the decision maker.,,,,,,,,,,,A Markov decision process is a mathematical model used to represent decision-making situations where outcomes are partially random and partially under the control of the decision maker.
Artificial Intelligence,What are autonomous vehicles?,Autonomous vehicles are self-driving cars that use AI technologies like computer vision, machine learning, and reinforcement learning to navigate and operate without human intervention.,,,,,,,,,Autonomous vehicles are self-driving cars that use AI technologies like computer vision  machine learning  and reinforcement learning to navigate and operate without human intervention.
Artificial Intelligence,What is the difference between AI and deep neural networks?,AI is the broad field, while deep neural networks are a specific type of model within AI that uses multiple layers of neurons to process data and learn patterns.,,,,,,,,,,AI is the broad field  while deep neural networks are a specific type of model within AI that uses multiple layers of neurons to process data and learn patterns.
Artificial Intelligence,What is NLP's role in sentiment analysis?,In sentiment analysis, NLP is used to process and analyze text data, identifying the underlying sentiment (positive, negative, or neutral) expressed by the text.,,,,,,,In sentiment analysis  NLP is used to process and analyze text data  identifying the underlying sentiment (positive  negative  or neutral) expressed by the text.
Artificial Intelligence,What is a knowledge graph?,A knowledge graph is a structured representation of information that links entities and their relationships, used in AI for reasoning, search, and decision-making.,,,,,,,,A knowledge graph is a structured representation of information that links entities and their relationships  used in AI for reasoning  search  and decision-making.
Artificial Intelligence,What is the role of data preprocessing in AI?,Data preprocessing involves cleaning and transforming raw data into a format suitable for training AI models, ensuring accuracy and quality in predictions.,,,,,,,,,,Data preprocessing involves cleaning and transforming raw data into a format suitable for training AI models  ensuring accuracy and quality in predictions.
Artificial Intelligence,What are the ethics of AI?,The ethics of AI concern the moral implications of AI systems, including fairness, transparency, privacy, accountability, and the impact of AI on jobs and society.,,,,,,The ethics of AI concern the moral implications of AI systems  including fairness  transparency  privacy  accountability  and the impact of AI on jobs and society.
Artificial Intelligence,What is the role of reinforcement learning in robotics?,In robotics, reinforcement learning is used to teach robots how to make decisions and learn from their environment by trial and error, improving their task performance over time.,,,,,,,,,In robotics  reinforcement learning is used to teach robots how to make decisions and learn from their environment by trial and error  improving their task performance over time.
Artificial Intelligence,What is a hybrid AI system?,A hybrid AI system combines different AI techniques, such as machine learning, knowledge-based systems, and natural language processing, to achieve better results in complex tasks.,,,,,,,A hybrid AI system combines different AI techniques  such as machine learning  knowledge-based systems  and natural language processing  to achieve better results in complex tasks.
Artificial Intelligence,What is swarm intelligence?,Swarm intelligence is a field of AI inspired by the collective behavior of decentralized systems, such as flocks of birds or colonies of ants, used to solve optimization problems.,,,,,,,,,Swarm intelligence is a field of AI inspired by the collective behavior of decentralized systems  such as flocks of birds or colonies of ants  used to solve optimization problems.
Artificial Intelligence,What is genetic algorithms in AI?,Genetic algorithms are optimization techniques based on the principles of natural selection, where solutions evolve over generations to find the best possible answer to a problem.,,,,,,,,,,Genetic algorithms are optimization techniques based on the principles of natural selection  where solutions evolve over generations to find the best possible answer to a problem.
