Domain,Question,,,,,,,,,,,,Answer
Mobile App Development,What is mobile app development?,Mobile app development is the process of creating software applications designed to run on mobile devices, such as smartphones and tablets.,,,,,,,,,,Mobile app development is the process of creating software applications designed to run on mobile devices  such as smartphones and tablets.
Mobile App Development,What are the major mobile platforms?,The two major mobile platforms are Android (developed by Google) and iOS (developed by Apple).,,,,,,,,,,,The two major mobile platforms are Android (developed by Google) and iOS (developed by Apple).
Mobile App Development,What is the difference between native and cross-platform app development?,Native app development uses platform-specific tools and languages (e.g., Swift for iOS, Kotlin for Android), while cross-platform development uses frameworks like Flutter or React Native to create apps for multiple platforms with a single codebase.,,,,,,,,Native app development uses platform-specific tools and languages (e.g.  Swift for iOS  Kotlin for Android)  while cross-platform development uses frameworks like Flutter or React Native to create apps for multiple platforms with a single codebase.
Mobile App Development,What is Android Studio?,Android Studio is the official integrated development environment (IDE) for Android app development, provided by Google.,,,,,,,,,,Android Studio is the official integrated development environment (IDE) for Android app development  provided by Google.
Mobile App Development,What is Xcode?,Xcode is Apple’s IDE used for developing iOS and macOS applications, providing tools for coding, debugging, and deploying apps.,,,,,,,,Xcode is Apple’s IDE used for developing iOS and macOS applications  providing tools for coding  debugging  and deploying apps.
Mobile App Development,What is a mobile app's User Interface (UI)?,A mobile app's User Interface (UI) is the visual part of the app that users interact with, including buttons, menus, and layouts.,,,,,,,,A mobile app's User Interface (UI) is the visual part of the app that users interact with  including buttons  menus  and layouts.
Mobile App Development,What is the role of an API in mobile app development?,APIs (Application Programming Interfaces) allow mobile apps to communicate with external services or data sources, enabling functionalities like authentication, data retrieval, and integration with third-party services.,,,,,,,,APIs (Application Programming Interfaces) allow mobile apps to communicate with external services or data sources  enabling functionalities like authentication  data retrieval  and integration with third-party services.
Mobile App Development,What is responsive design in mobile apps?,Responsive design ensures that a mobile app adjusts its layout and functionality to fit different screen sizes and orientations.,,,,,,,,,,,Responsive design ensures that a mobile app adjusts its layout and functionality to fit different screen sizes and orientations.
Mobile App Development,What are the benefits of using Flutter for app development?,Flutter, developed by Google, allows developers to create high-performance cross-platform apps with a single codebase, offering fast development, a rich widget library, and customizable UI designs.,,,,,,Flutter  developed by Google  allows developers to create high-performance cross-platform apps with a single codebase  offering fast development  a rich widget library  and customizable UI designs.
Mobile App Development,What is Swift?,Swift is a programming language developed by Apple for creating iOS and macOS applications.,,,,,,,,,,,Swift is a programming language developed by Apple for creating iOS and macOS applications.
Mobile App Development,What is Kotlin?,Kotlin is a modern programming language officially supported by Google for Android app development, known for its simplicity and safety features.,,,,,,,,,,Kotlin is a modern programming language officially supported by Google for Android app development  known for its simplicity and safety features.
Mobile App Development,What is React Native?,React Native is a cross-platform app development framework developed by Facebook, allowing developers to create apps for iOS and Android using JavaScript.,,,,,,,,,,React Native is a cross-platform app development framework developed by Facebook  allowing developers to create apps for iOS and Android using JavaScript.
Mobile App Development,What is a hybrid app?,A hybrid app is a mobile application built using web technologies like HTML, CSS, and JavaScript, wrapped in a native container to run on multiple platforms.,,,,,,,,A hybrid app is a mobile application built using web technologies like HTML  CSS  and JavaScript  wrapped in a native container to run on multiple platforms.
Mobile App Development,What is an Activity in Android?,An Activity is a single screen in an Android app, acting as an entry point for user interaction.,,,,,,,,,,An Activity is a single screen in an Android app  acting as an entry point for user interaction.
Mobile App Development,What is a Fragment in Android?,A Fragment represents a reusable portion of the UI in an Android app, used to create dynamic and flexible interfaces.,,,,,,,,,,A Fragment represents a reusable portion of the UI in an Android app  used to create dynamic and flexible interfaces.
Mobile App Development,What is Core Data in iOS?,Core Data is a framework provided by Apple for managing the app's data model and handling persistent data storage in iOS applications.,,,,,,,,,,,Core Data is a framework provided by Apple for managing the app's data model and handling persistent data storage in iOS applications.
Mobile App Development,What is Firebase?,Firebase is a platform developed by Google that provides various backend services for mobile app development, including authentication, database, storage, and cloud functions.,,,,,,,Firebase is a platform developed by Google that provides various backend services for mobile app development  including authentication  database  storage  and cloud functions.
Mobile App Development,What is a mobile app's backend?,The backend of a mobile app is the server-side infrastructure that supports app functionality, handling tasks like database management, authentication, and API requests.,,,,,,,,The backend of a mobile app is the server-side infrastructure that supports app functionality  handling tasks like database management  authentication  and API requests.
Mobile App Development,What is the role of a mobile app developer?,A mobile app developer designs, codes, tests, and maintains mobile applications for specific platforms like Android or iOS.,,,,,,,,A mobile app developer designs  codes  tests  and maintains mobile applications for specific platforms like Android or iOS.
Mobile App Development,What is mobile app testing?,Mobile app testing ensures that an app functions correctly, is user-friendly, and performs well across different devices and operating systems.,,,,,,,,,Mobile app testing ensures that an app functions correctly  is user-friendly  and performs well across different devices and operating systems.
Mobile App Development,What is A/B testing in mobile apps?,A/B testing involves comparing two versions of an app feature or design to determine which performs better based on user interactions.,,,,,,,,,,,A/B testing involves comparing two versions of an app feature or design to determine which performs better based on user interactions.
Mobile App Development,What is the difference between a debug build and a release build?,A debug build is used during development and testing, containing debugging information, while a release build is optimized and ready for deployment to app stores.,,,,,,,,,A debug build is used during development and testing  containing debugging information  while a release build is optimized and ready for deployment to app stores.
Mobile App Development,What are push notifications?,Push notifications are messages sent from a mobile app to a user's device to provide updates, alerts, or other information, even when the app is not in use.,,,,,,,,Push notifications are messages sent from a mobile app to a user's device to provide updates  alerts  or other information  even when the app is not in use.
Mobile App Development,What is the App Store?,The App Store is Apple's platform for distributing iOS applications, allowing developers to upload and sell their apps.,,,,,,,,,,The App Store is Apple's platform for distributing iOS applications  allowing developers to upload and sell their apps.
Mobile App Development,What is Google Play Store?,Google Play Store is Google's platform for distributing Android applications, offering apps, games, and other digital content.,,,,,,,,Google Play Store is Google's platform for distributing Android applications  offering apps  games  and other digital content.
Mobile App Development,What is the difference between a mobile website and a mobile app?,A mobile website is accessed through a browser and does not require installation, while a mobile app is downloaded and installed on a device, offering more functionality and offline access.,,,,,,,,,A mobile website is accessed through a browser and does not require installation  while a mobile app is downloaded and installed on a device  offering more functionality and offline access.
Mobile App Development,What is a micro-interaction in mobile apps?,Micro-interactions are small design elements in mobile apps, such as animations or button feedback, that enhance user engagement and experience.,,,,,,,,,Micro-interactions are small design elements in mobile apps  such as animations or button feedback  that enhance user engagement and experience.
Mobile App Development,What is an SDK?,An SDK (Software Development Kit) is a collection of tools, libraries, and documentation provided by platform providers to help developers build apps.,,,,,,,,,An SDK (Software Development Kit) is a collection of tools  libraries  and documentation provided by platform providers to help developers build apps.
Mobile App Development,What is OAuth?,OAuth is a standard protocol for authorization, allowing users to grant third-party applications access to their data without sharing credentials.,,,,,,,,,,OAuth is a standard protocol for authorization  allowing users to grant third-party applications access to their data without sharing credentials.
Mobile App Development,What are the key principles of mobile app design?,Key principles include simplicity, responsiveness, intuitive navigation, consistency, and performance optimization.,,,,,,,Key principles include simplicity  responsiveness  intuitive navigation  consistency  and performance optimization.
Mobile App Development,What is MVVM in mobile app development?,MVVM (Model-View-ViewModel) is an architectural pattern that separates the business logic, UI, and data-binding in app development, often used in Android and iOS apps.,,,,,,,,MVVM (Model-View-ViewModel) is an architectural pattern that separates the business logic  UI  and data-binding in app development  often used in Android and iOS apps.
Mobile App Development,What is localization in mobile apps?,Localization is the process of adapting an app’s content, language, and design to suit different regions, languages, and cultural preferences.,,,,,,,Localization is the process of adapting an app’s content  language  and design to suit different regions  languages  and cultural preferences.
Mobile App Development,What is mobile app monetization?,Mobile app monetization refers to methods like in-app purchases, subscriptions, ads, and paid downloads to generate revenue from an app.,,,,,,,,Mobile app monetization refers to methods like in-app purchases  subscriptions  ads  and paid downloads to generate revenue from an app.
Mobile App Development,What is AR in mobile apps?,AR (Augmented Reality) in mobile apps overlays digital objects onto the real world using a device's camera, creating an interactive user experience.,,,,,,,,,,AR (Augmented Reality) in mobile apps overlays digital objects onto the real world using a device's camera  creating an interactive user experience.
Mobile App Development,What is the difference between synchronous and asynchronous calls in mobile apps?,Synchronous calls block the execution until the operation completes, while asynchronous calls allow other processes to run while waiting for the operation to finish.,,,,,,,,,,Synchronous calls block the execution until the operation completes  while asynchronous calls allow other processes to run while waiting for the operation to finish.
Mobile App Development,What is an Intent in Android?,An Intent is a messaging object in Android used to request an action from another app component, such as opening an Activity or Service.,,,,,,,,,,An Intent is a messaging object in Android used to request an action from another app component  such as opening an Activity or Service.
Mobile App Development,What is provisioning in iOS development?,Provisioning is the process of setting up an iOS device or app for development, testing, or distribution using provisioning profiles.,,,,,,,,,Provisioning is the process of setting up an iOS device or app for development  testing  or distribution using provisioning profiles.
Mobile App Development,What is ProGuard in Android?,ProGuard is a tool in Android development that optimizes and obfuscates code, reducing app size and protecting it from reverse engineering.,,,,,,,,,,ProGuard is a tool in Android development that optimizes and obfuscates code  reducing app size and protecting it from reverse engineering.
Mobile App Development,What are ANR errors in Android?,ANR (Application Not Responding) errors occur when an Android app becomes unresponsive for a prolonged period, often due to heavy processing on the main thread.,,,,,,,,,,ANR (Application Not Responding) errors occur when an Android app becomes unresponsive for a prolonged period  often due to heavy processing on the main thread.
Mobile App Development,What is a mobile app’s minimum viable product (MVP)?,An MVP (Minimum Viable Product) is a version of an app with core features released early to gather user feedback and validate the concept.,,,,,,,,,,,An MVP (Minimum Viable Product) is a version of an app with core features released early to gather user feedback and validate the concept.
Mobile App Development,What is the importance of mobile app analytics?,Mobile app analytics track user behavior, engagement, and performance, helping developers optimize the app and improve user satisfaction.,,,,,,,,Mobile app analytics track user behavior  engagement  and performance  helping developers optimize the app and improve user satisfaction.
Mobile App Development,What is a service in Android?,A Service in Android is a component used to perform long-running operations in the background without a user interface.,,,,,,,,,,,A Service in Android is a component used to perform long-running operations in the background without a user interface.
Mobile App Development,What is a TableView in iOS?,A TableView in iOS is a UI component used to display a list of items in a single-column format, commonly seen in apps like Contacts or Settings.,,,,,,,,,,A TableView in iOS is a UI component used to display a list of items in a single-column format  commonly seen in apps like Contacts or Settings.
Mobile App Development,What is App Transport Security (ATS) in iOS?,App Transport Security (ATS) is a feature in iOS that enforces secure connections (HTTPS) between the app and servers.,,,,,,,,,,,App Transport Security (ATS) is a feature in iOS that enforces secure connections (HTTPS) between the app and servers.
Mobile App Development,What are in-app purchases?,In-app purchases allow users to buy virtual goods, subscriptions, or premium features directly within a mobile app.,,,,,,,,,In-app purchases allow users to buy virtual goods  subscriptions  or premium features directly within a mobile app.
Mobile App Development,What is lazy loading in mobile app development?,Lazy loading is a technique used to load resources or data only when they are needed, improving app performance and reducing initial load times.,,,,,,,,,,Lazy loading is a technique used to load resources or data only when they are needed  improving app performance and reducing initial load times.
Mobile App Development,What is dependency injection in mobile apps?,Dependency injection is a design pattern that provides objects their dependencies, improving code modularity and testability.,,,,,,,,,,Dependency injection is a design pattern that provides objects their dependencies  improving code modularity and testability.
Mobile App Development,What is deep linking in mobile apps?,Deep linking is a method of directing users to specific content or pages within an app using a unique URL or link.,,,,,,,,,,,Deep linking is a method of directing users to specific content or pages within an app using a unique URL or link.
Mobile App Development,What are the challenges of mobile app development?,Challenges include device fragmentation, platform differences, performance optimization, security, and user experience design.,,,,,,,Challenges include device fragmentation  platform differences  performance optimization  security  and user experience design.
,,,,,,,,,,,,,
,,,,,,,,,,,,,
,,,,,,,,,,,,,
,,,,,,,,,,,,,
,,,,,,,,,,,,,
